[
  {
    "id": "q1",
    "skill": "transformers",
    "type": "derivation",
    "difficulty": 3,
    "prompt": "Derive why scaled dot-product attention divides QK\u1d40 by \u221ad\u2096. What instability is the scaling intended to reduce?",
    "expected": "Relate dot-product variance to d\u2096 and explain how large logits can saturate softmax gradients."
  },
  {
    "id": "q2",
    "skill": "retrieval",
    "type": "diagnosis",
    "difficulty": 4,
    "prompt": "A RAG system answers easy questions well but fails on obscure facts buried deep in long documents. What should you inspect before changing the LLM?",
    "expected": "Check retrieval recall, chunking, query formulation, top-k, reranking and whether the evidence enters context."
  },
  {
    "id": "q3",
    "skill": "evaluation",
    "type": "design",
    "difficulty": 5,
    "prompt": "Design an evaluation set that separates retrieval failures from generation failures in a RAG system.",
    "expected": "Use known evidence and retrieval-level labels or metrics, then score generation conditional on evidence being retrieved."
  },
  {
    "id": "q4",
    "skill": "inference",
    "type": "transfer",
    "difficulty": 5,
    "prompt": "Sequence length doubles while model weights stay fixed. Predict major inference memory and latency effects and explain the role of KV caching.",
    "expected": "Reason separately about attention compute, cache growth and weight memory."
  }
]